{
  "schema": "factory.model-profile/v1",
  "id": "valid-readonly-child",
  "version": "1.0.0",
  "extends": "staged-baseline@1.0.0",
  "adapter": {
    "adapter_id": "claude-staged-v1",
    "executable": "claude -p",
    "allowed_tools": [
      "read_file",
      "grep"
    ],
    "filesystem": "read-only",
    "network": "none"
  },
  "routing": {},
  "telemetry": {}
}
